{
  "schema": "go-workflow.release-evidence.v1",
  "status": "verified",
  "task_id": "reliability-01",
  "project": "go-workflow-stack",
  "contract_digest": "6a7b73abe8ef30346d9e697d44368f2ce9ee42430474eb9c6269e869ef2f7dc0",
  "content_digest": "4936af0576dbfa4758973aa5aab64fada98b7afc1801acb382b4a8b6846d1b5b",
  "profile": {
    "name": "github-release",
    "provider": "github-release",
    "remote": "origin",
    "branch": "main",
    "repository": "viggomeesters/go-workflow-stack"
  },
  "remote_url": "https://github.com/viggomeesters/go-workflow-stack.git",
  "tag": "v0.3.28",
  "commit": "9689a77f00a46f03e63185c12837d5ca1f94025c",
  "tag_object": "3d2a13a212a376b95a997d1f0299bdefdbb602e5",
  "branch_commit": "9689a77f00a46f03e63185c12837d5ca1f94025c",
  "refs": {
    "refs/heads/main": "9689a77f00a46f03e63185c12837d5ca1f94025c",
    "refs/tags/v0.3.28": "3d2a13a212a376b95a997d1f0299bdefdbb602e5",
    "refs/tags/v0.3.28^{}": "9689a77f00a46f03e63185c12837d5ca1f94025c"
  },
  "publication": {
    "isDraft": false,
    "isPrerelease": false,
    "publishedAt": "2026-09-14T13:41:20Z",
    "tagName": "v0.3.28",
    "url": "https://github.com/viggomeesters/go-workflow-stack/releases/tag/v0.3.28"
  },
  "observed_at": "2026-09-14T13:41:34.938419+00:00"
}
