{
  "schema": "go-workflow.release-evidence.v1",
  "status": "verified",
  "task_id": "abc-07",
  "project": "go-workflow-stack",
  "contract_digest": "84dfe3e0cd80302c86ade82f772a2b74482a0a540fafd8714570b6909755c30d",
  "content_digest": "5ac7894b220b80c80e9de9149abc723aafe938860418c5d80ebb3d80e5cfb240",
  "profile": {
    "name": "github-release",
    "provider": "github-release",
    "remote": "origin",
    "branch": "main",
    "repository": "viggomeesters/go-workflow-stack"
  },
  "remote_url": "https://github.com/viggomeesters/go-workflow-stack.git",
  "tag": "v0.3.23",
  "commit": "654077aceee71c136a7c2473140b301d4385fc53",
  "tag_object": "ceb776e5f428ddd8d7de6f1a6ccd08b0c959ba26",
  "branch_commit": "654077aceee71c136a7c2473140b301d4385fc53",
  "refs": {
    "refs/heads/main": "654077aceee71c136a7c2473140b301d4385fc53",
    "refs/tags/v0.3.23": "ceb776e5f428ddd8d7de6f1a6ccd08b0c959ba26",
    "refs/tags/v0.3.23^{}": "654077aceee71c136a7c2473140b301d4385fc53"
  },
  "publication": {
    "isDraft": false,
    "isPrerelease": false,
    "publishedAt": "2026-09-13T17:28:53Z",
    "tagName": "v0.3.23",
    "url": "https://github.com/viggomeesters/go-workflow-stack/releases/tag/v0.3.23"
  },
  "observed_at": "2026-09-13T17:28:59.624982+00:00"
}
