{
  "schema": "go-workflow.release-evidence.v1",
  "status": "verified",
  "task_id": "autonomy-08",
  "project": "go-workflow-stack",
  "contract_digest": "3b812f23610250f0993a281c858620f6605ec4fbf612919d8e17d4927be1b6b5",
  "content_digest": "0dd764f562cc41b306f627cb6a094601d45667db5d32eadd55a825e3b9ffd584",
  "profile": {
    "name": "github-release",
    "provider": "github-release",
    "remote": "origin",
    "branch": "main",
    "repository": "viggomeesters/go-workflow-stack"
  },
  "remote_url": "https://github.com/viggomeesters/go-workflow-stack.git",
  "tag": "v0.3.42",
  "commit": "aa4603a4fd10001138e65d428dcaf848c5a57089",
  "tag_object": "6ea8d008dfbe17b2a8e48353b3c31abd454ec50e",
  "branch_commit": "aa4603a4fd10001138e65d428dcaf848c5a57089",
  "refs": {
    "refs/heads/main": "aa4603a4fd10001138e65d428dcaf848c5a57089",
    "refs/tags/v0.3.42": "6ea8d008dfbe17b2a8e48353b3c31abd454ec50e",
    "refs/tags/v0.3.42^{}": "aa4603a4fd10001138e65d428dcaf848c5a57089"
  },
  "publication": {
    "isDraft": false,
    "isPrerelease": false,
    "publishedAt": "2026-09-22T13:03:11Z",
    "tagName": "v0.3.42",
    "url": "https://github.com/viggomeesters/go-workflow-stack/releases/tag/v0.3.42"
  },
  "observed_at": "2026-09-22T13:05:31.069916+00:00"
}
