{
  "schema": "go-workflow.release-evidence.v1",
  "status": "verified",
  "task_id": "fix-legacy-lifecycle-metadata",
  "project": "go-workflow-stack",
  "contract_digest": "9d6b887a7091bde8235855e3974eeffe4fc08f596b71c5195175767581c8f0e7",
  "content_digest": "1880d4b1e19885a1f345572d42a8ba3ee09710c23226e869bef3a5d11ea22a71",
  "profile": {
    "name": "github-release",
    "provider": "github-release",
    "remote": "origin",
    "branch": "main",
    "repository": "viggomeesters/go-workflow-stack"
  },
  "remote_url": "https://github.com/viggomeesters/go-workflow-stack.git",
  "tag": "v0.3.27",
  "commit": "1fbdf56c4d113dcb09ff1142ad56a6688793f08c",
  "tag_object": "e5543d8c6edd3fd24caf2920c20c28c629f81552",
  "branch_commit": "1fbdf56c4d113dcb09ff1142ad56a6688793f08c",
  "refs": {
    "refs/heads/main": "1fbdf56c4d113dcb09ff1142ad56a6688793f08c",
    "refs/tags/v0.3.27": "e5543d8c6edd3fd24caf2920c20c28c629f81552",
    "refs/tags/v0.3.27^{}": "1fbdf56c4d113dcb09ff1142ad56a6688793f08c"
  },
  "publication": {
    "isDraft": false,
    "isPrerelease": false,
    "publishedAt": "2026-09-14T09:22:38Z",
    "tagName": "v0.3.27",
    "url": "https://github.com/viggomeesters/go-workflow-stack/releases/tag/v0.3.27"
  },
  "observed_at": "2026-09-14T09:22:55.832383+00:00"
}
